{
  "$id": "https://trader-bot.local/contracts/v1/approved_trade_intent.v1.json",
  "$schema": "https://json-schema.org/draft/2020-12/schema",
  "title": "ApprovedTradeIntentV1",
  "type": "object",
  "additionalProperties": false,
  "required": [
    "schema_version",
    "intent_id",
    "decision_id",
    "risk_decision_id",
    "account_id",
    "instrument_id",
    "action",
    "order_plan",
    "risk_budget",
    "target_position_id",
    "valid_until",
    "idempotency_key",
    "approved_at"
  ],
  "properties": {
    "schema_version": {
      "type": "string",
      "const": "1.0"
    },
    "intent_id": {
      "type": "string",
      "format": "uuid"
    },
    "decision_id": {
      "type": "string",
      "format": "uuid"
    },
    "risk_decision_id": {
      "type": "string",
      "format": "uuid"
    },
    "account_id": {
      "type": "string"
    },
    "instrument_id": {
      "type": "string",
      "description": "Nautilus InstrumentId"
    },
    "action": {
      "type": "string",
      "enum": [
        "open_position",
        "add_position",
        "partial_close",
        "close_position",
        "move_stop_loss",
        "move_stop_to_entry",
        "replace_take_profits",
        "cancel_order"
      ]
    },
    "order_plan": {
      "type": "object",
      "additionalProperties": true,
      "properties": {
        "side": {
          "type": "string",
          "enum": [
            "buy",
            "sell"
          ]
        },
        "type": {
          "type": "string",
          "enum": [
            "market",
            "limit",
            "zone",
            "entry_batch"
          ]
        },
        "time_in_force": {
          "type": "string",
          "enum": [
            "GTC",
            "IOC",
            "FOK",
            "GTD"
          ]
        },
        "quantity": {
          "type": "string"
        },
        "price": {
          "type": "number"
        },
        "price_min": {
          "type": "number"
        },
        "price_max": {
          "type": "number"
        },
        "stop_loss": {
          "type": "number"
        },
        "stop_price": {
          "type": "number"
        },
        "limit_price": {
          "type": "number"
        },
        "trigger_price": {
          "type": "number"
        },
        "leverage": {
          "type": "number"
        },
        "take_profits": {
          "type": "array",
          "items": {
            "type": "number"
          }
        },
        "protection_policy": {
          "type": "string",
          "description": "Explicit protection completeness declaration for open/add plans. Optional for backward compatibility.",
          "enum": [
            "complete",
            "stop_only",
            "deferred",
            "waived"
          ]
        },
        "plan_version": {
          "type": "string",
          "enum": [
            "1.1"
          ]
        },
        "policy": {
          "type": "string"
        },
        "mode": {
          "type": "string",
          "enum": [
            "zone_ladder",
            "single_limit",
            "market"
          ]
        },
        "tranches": {
          "type": "array",
          "items": {
            "type": "object",
            "additionalProperties": false,
            "required": [
              "tranche_id",
              "seq",
              "price",
              "quantity"
            ],
            "properties": {
              "tranche_id": {
                "type": "string"
              },
              "seq": {
                "type": "integer",
                "minimum": 1,
                "maximum": 9
              },
              "price": {
                "type": "number"
              },
              "quantity": {
                "type": "string"
              },
              "risk_weight": {
                "type": "number",
                "minimum": 0,
                "maximum": 1
              },
              "style": {
                "type": "string",
                "enum": [
                  "chase",
                  "rest"
                ]
              },
              "limit_cap": {
                "type": "number"
              },
              "type": {
                "type": "string",
                "enum": [
                  "market",
                  "limit"
                ]
              },
              "sizing_price": {
                "type": "string",
                "pattern": "^[0-9]+(\\.[0-9]+)?$"
              }
            }
          }
        },
        "invalidation": {
          "type": "object",
          "additionalProperties": false,
          "properties": {
            "cancel_on_price_touch": {
              "type": "number"
            },
            "cancel_on_close_beyond": {
              "type": "number"
            },
            "close_bar": {
              "type": "string"
            },
            "expires_at": {
              "type": "string",
              "format": "date-time"
            }
          }
        },
        "batch_version": {
          "type": "string",
          "enum": [
            "1"
          ]
        },
        "estimated_stop_risk": {
          "type": "string",
          "pattern": "^[0-9]+(\\.[0-9]+)?$"
        },
        "entry_expires_at": {
          "type": "string",
          "format": "date-time"
        }
      },
      "allOf": [
        {
          "if": {
            "required": [
              "type"
            ],
            "properties": {
              "type": {
                "const": "entry_batch"
              }
            }
          },
          "then": {
            "required": [
              "batch_version",
              "side",
              "tranches",
              "stop_loss",
              "estimated_stop_risk"
            ],
            "properties": {
              "tranches": {
                "minItems": 2,
                "maxItems": 3,
                "items": {
                  "required": [
                    "type",
                    "sizing_price"
                  ]
                }
              }
            }
          }
        }
      ]
    },
    "execution": {
      "type": "object",
      "additionalProperties": false,
      "description": "Optional additive order-management execution hints. Absence preserves legacy/default v1 behavior.",
      "properties": {
        "order_type": {
          "type": "string",
          "enum": [
            "market",
            "limit",
            "zone"
          ]
        },
        "time_in_force": {
          "type": "string",
          "enum": [
            "GTC",
            "IOC",
            "FOK",
            "GTD"
          ]
        },
        "post_only": {
          "type": "boolean"
        },
        "reduce_only": {
          "type": "boolean"
        },
        "max_slippage_bps": {
          "type": "number",
          "minimum": 0
        },
        "limit_price": {
          "type": "number",
          "exclusiveMinimum": 0
        },
        "zone": {
          "type": "object",
          "additionalProperties": false,
          "properties": {
            "low": {
              "type": "number",
              "exclusiveMinimum": 0
            },
            "high": {
              "type": "number",
              "exclusiveMinimum": 0
            }
          }
        }
      }
    },
    "protection": {
      "type": "object",
      "additionalProperties": false,
      "description": "Optional additive order-management protection hints. Absence preserves legacy/default v1 behavior.",
      "properties": {
        "require_stop": {
          "type": "boolean"
        },
        "stop": {
          "type": "object",
          "additionalProperties": false,
          "properties": {
            "type": {
              "type": "string",
              "enum": [
                "stop_market",
                "stop_limit"
              ]
            },
            "trigger_basis": {
              "type": "string",
              "enum": [
                "mark",
                "last"
              ]
            },
            "price": {
              "type": "number",
              "exclusiveMinimum": 0
            },
            "distance_pct": {
              "type": "number",
              "exclusiveMinimum": 0
            }
          }
        },
        "take_profits": {
          "type": "array",
          "items": {
            "type": "object",
            "additionalProperties": false,
            "properties": {
              "price": {
                "type": "number",
                "exclusiveMinimum": 0
              },
              "r_multiple": {
                "type": "number",
                "exclusiveMinimum": 0
              },
              "fraction": {
                "type": "number",
                "exclusiveMinimum": 0,
                "maximum": 1
              },
              "quantity": {
                "type": "number",
                "exclusiveMinimum": 0
              },
              "time_in_force": {
                "type": "string",
                "enum": [
                  "GTC",
                  "IOC",
                  "FOK",
                  "GTD"
                ]
              }
            }
          }
        },
        "breakeven": {
          "type": "object",
          "additionalProperties": false,
          "properties": {
            "enabled": {
              "type": "boolean"
            },
            "trigger_r": {
              "type": "number",
              "minimum": 0
            },
            "offset_bps": {
              "type": "number",
              "minimum": 0
            }
          }
        },
        "trailing": {
          "type": "object",
          "additionalProperties": false,
          "properties": {
            "enabled": {
              "type": "boolean"
            },
            "activation_r": {
              "type": "number",
              "minimum": 0
            },
            "callback_rate": {
              "type": "number",
              "exclusiveMinimum": 0
            },
            "min_step": {
              "type": "number",
              "minimum": 0
            }
          }
        }
      }
    },
    "sizing": {
      "type": "object",
      "additionalProperties": false,
      "description": "Optional additive order-management sizing hint. Absence preserves legacy/default v1 behavior.",
      "properties": {
        "quantity": {
          "type": "number",
          "exclusiveMinimum": 0
        },
        "fraction": {
          "type": "number",
          "exclusiveMinimum": 0,
          "maximum": 1
        }
      }
    },
    "risk_budget": {
      "type": "object",
      "additionalProperties": false,
      "required": [
        "risk_fraction",
        "max_notional",
        "max_leverage"
      ],
      "properties": {
        "risk_fraction": {
          "type": "number",
          "minimum": 0
        },
        "max_notional": {
          "type": "number",
          "minimum": 0
        },
        "max_leverage": {
          "type": "number",
          "minimum": 0
        }
      }
    },
    "target_position_id": {
      "type": [
        "null",
        "string"
      ]
    },
    "valid_until": {
      "type": "string",
      "format": "date-time"
    },
    "idempotency_key": {
      "type": "string",
      "minLength": 64,
      "maxLength": 64,
      "pattern": "^[0-9a-f]{64}$"
    },
    "approved_at": {
      "type": "string",
      "format": "date-time"
    }
  }
}
